<?xml version="1.0" encoding="UTF-8"?>
<!--
Click nbfs://nbhost/SystemFileSystem/Templates/Licenses/license-default.txt to change this license
Click nbfs://nbhost/SystemFileSystem/Templates/XML/emptyDTD.dtd to edit this template
-->

<!--
    TODO define vocabulary identification data
    PUBLIC ID  : -//vendor//vocabulary//EN
    SYSTEM ID  : http://server/path/__NAME__
-->

<!-- TODO define your own vocabulary/syntax. Example follows:  -->
<!ELEMENT ordinateur (boitier+)>
<!ELEMENT boitier (cartmere*,cartegraphique*,processeur*,ram*)>
<!ELEMENT cartemÃ¨re (cartegraphique*,processeur*,ram*)>
<!ELEMENT cartegraphique (marque?,modele?)>
<!ELEMENT processeur (marque?,modele?)>
<!ELEMENT ram (marque?,modele?)>
<!ELEMENT marque (#PCDATA)>
<!ELEMENT modele (#PCDATA)>